{
  "$schema": "https://echo-ui-automation/schemas/contracts/state/v1",
  "stateId": "modelLoading",
  "surfaceId": "onboarding",
  "dataConditions": {
    "currentStep": "modelLoading",
    "privacyConsent": "agreed",
    "permissionStepIndex": "complete",
    "language": "zh-Hans | en-US",
    "modelLoadProgress": "0.0..1.0 (determinate)"
  },
  "allowedActions": [],
  "expectedSemantics": {
    "progress": "Determinate ProgressView(value:total:) + 'Loading models…' (echo-memory-canvas §15.6)",
    "announcement": "Progress changes announced; no cancel (first-launch blocking state)",
    "autoTransition": "Transitions to completed when progress reaches 1.0 (fixture-driven; real ModelLoaderActor Phase 3.9)"
  },
  "version": "1.0.0"
}
